Keyword,Volume,Keyword Difficulty,CPC (USD),Competitive Density,Number of Results,Intent,SERP Features,Trend,Competitors
Belts,33100,57,0.77,1,1910000000,Commercial,"Site links, FAQ, Image, Top stories, Video carousel","0.54,0.66,0.81,1.00,0.66,0.81,0.66,0.81,0.66,0.81,0.81,0.54","Vaincourt, kaporal"
Leather belts,6600,42,0.94,1,83600000,Commercial,"Site links, FAQ, Video, Image, Shopping ads, Adwords bottom","0.66,1.00,0.81,0.44,0.44,0.54,0.54,0.66,0.66,0.66,0.66,0.54","Vertical l'Accessoire, Joseph Bonnie"
Western belts,6600,49,0.28,1,49800000,Commercial,"Video, Image, Adwords bottom","0.36,0.36,0.36,0.81,0.54,0.81,0.66,0.36,1.00,0.44,0.54,0.54","Cavender's, wild wild western wear"
Tool belts,5400,57,0.75,1,60800000,Commercial,"Site links, FAQ, Video, Image, People also ask","0.29,0.36,0.36,0.36,0.36,0.36,0.44,0.29,0.36,0.29,0.16,0.16","Diamondback, Buckaroo"
Weightlifting belts,4400,61,0.55,1,9160000,Commercial,"Site links, FAQ, Video, Image, People also ask","0.44,0.44,0.29,1.00,0.54,0.29,0.19,0.19,0.23,0.36,0.29,0.19",NO
Dress belts,3600,50,0.62,1,83600000,Commercial,"Site links, Image","0.54,0.23,0.29,0.81,0.23,0.29,0.81,0.13,0.07,0.13,0.05,0.07","Nord Storm, "